Date,Hour,Country,Region,Department,City,Temperature,Felt Temp,Wind,Sky
14/01/2021,20:15,France,CENTRE-LOIRE VALLEY,CHER,Saint-Amand-Montrond,8°,Feels Like 5°,55km/h,Pluie faible intermittente ou faibles averses
14/01/2021,20:15,France,CENTRE-LOIRE VALLEY,CHER,Bourges,8°,Feels Like 4°,55km/h,Faibles averses ou pluie faible intermittente
14/01/2021,20:16,France,CENTRE-LOIRE VALLEY,CHER,Sancerre,8°,Feels Like 3°,50km/h,Faibles averses ou pluie faible intermittente
14/01/2021,20:16,France,CENTRE-LOIRE VALLEY,CHER,Argent-sur-Sauldre,8°,Feels Like 4°,50km/h,"Averses, ou arrivée de la pluie"
14/01/2021,20:16,France,CENTRE-LOIRE VALLEY,CHER,Sancoins,8°,Feels Like 3°,55km/h,Pluie faible intermittente ou faibles averses
